{
  "$schema": "http://json-schema.org/draft-07/schema#",
  "title": "Command",
  "type": "object",
  "additionalProperties": false,
  "required": ["id", "title", "description", "syntax", "examples"],
  "properties": {
    "id": { "type": "string", "pattern": "^[a-z0-9.-]+$" },
    "title": { "type": "string", "minLength": 1 },
    "description": { "type": "string", "minLength": 1 },
    "syntax": { "type": "string", "minLength": 1 },
    "examples": {
      "type": "array",
      "minItems": 1,
      "items": {
        "type": "object",
        "additionalProperties": false,
        "required": ["cmd", "desc"],
        "properties": {
          "cmd": { "type": "string", "minLength": 1 },
          "desc": { "type": "string", "minLength": 1 }
        }
      }
    },
    "options": {
      "type": "array",
      "items": {
        "type": "object",
        "additionalProperties": false,
        "required": ["flag", "desc"],
        "properties": {
          "flag": { "type": "string", "minLength": 1 },
          "desc": { "type": "string", "minLength": 1 }
        }
      }
    }
  }
}
