{
  "id": "sftp",
  "title": "sftp — Transferencia interactiva por SSH",
  "description": "Cliente interactivo tipo FTP sobre SSH para subir, bajar y gestionar archivos remotos.",
  "syntax": "sftp [opciones] usuario@host",
  "examples": [
    { "cmd": "sftp usuario@host", "desc": "Abre una sesión interactiva." },
    { "cmd": "sftp -P 2222 usuario@host", "desc": "Con puerto personalizado." }
  ],
  "options": [
    { "flag": "-P", "desc": "Puerto." },
    { "flag": "-i", "desc": "Clave privada." },
    { "flag": "-b", "desc": "Ejecuta un lote de comandos desde archivo." }
  ]
}
