{
  "id": "sar",
  "title": "sar — Histórico de rendimiento",
  "description": "Recoge, reporta y guarda información histórica de actividad del sistema (CPU, memoria, red, E/S).",
  "syntax": "sar [opciones] [intervalo] [repeticiones]",
  "examples": [
    { "cmd": "sar -u 2 5", "desc": "Uso de CPU cada 2 segundos, 5 veces." },
    { "cmd": "sar -r", "desc": "Uso de memoria." },
    { "cmd": "sar -n DEV 1 3", "desc": "Estadísticas de red." }
  ],
  "options": [
    { "flag": "-u", "desc": "Uso de CPU." },
    { "flag": "-r", "desc": "Uso de memoria." },
    { "flag": "-n", "desc": "Estadísticas de red." },
    { "flag": "-f", "desc": "Lee datos de un archivo histórico." }
  ]
}
